{"base_commit":"fbb0901f92b8806c5a0a9b7a70a634e7fca6e214","candidate_tree":"1119903664339fe8eeaf61c911d602445ac14c73","checks":[{"assertions":[{"actual":0,"comparison":"candidate-minus-baseline","expected":0,"metric":"/failures","operator":"lte","passed":true,"reason_codes":[],"report":"junit"},{"actual":0,"comparison":"candidate-minus-baseline","expected":0,"metric":"/errors","operator":"lte","passed":true,"reason_codes":[],"report":"junit"},{"actual":90.0,"comparison":"candidate","expected":85,"metric":"/percent_covered","operator":"gte","passed":true,"reason_codes":[],"report":"coverage"},{"actual":-0.11857707509881266,"comparison":"candidate-minus-baseline","expected":-1,"metric":"/percent_covered","operator":"gte","passed":true,"reason_codes":[],"report":"coverage"}],"id":"tests-and-coverage","mode":"differential","reason_codes":[],"severity":"blocking","status":"PASS"},{"assertions":[{"actual":0,"comparison":"candidate","expected":0,"metric":"/remaining","operator":"eq","passed":true,"reason_codes":[],"report":"consistency"}],"id":"task-consistency","mode":"candidate","reason_codes":[],"severity":"blocking","status":"PASS"},{"assertions":[],"id":"types","mode":"candidate","reason_codes":[],"severity":"advisory","status":"PASS"}],"config_sha256":"853db4b43f2001c4ed3251b6ac96478b09eb82f2d75bc7c5a22f639041c9f6c1","duration_ms":11189,"exit_code":0,"finished_at":"2026-09-03T19:39:47.817123Z","manifest_path":"manifest.json","patch_sha256":"d1c5fced09047e9cce7fecc2958551f5a55f5de32e54b3de20087471708222b2","reason_codes":[],"run_id":"20260903T193936Z-0fb8a9fa13d9","scope":{"changed_paths":["README.md","setup.py","slugify/slugify.py","tox.ini"],"forbidden_paths":[],"outside_allowed_paths":[],"reason_codes":[],"review_required_paths":[],"status":"PASS"},"started_at":"2026-09-03T19:39:36.626916Z","verdict":"PASS","version":1}
