{"base_commit":"fbb0901f92b8806c5a0a9b7a70a634e7fca6e214","candidate_tree":"a5f83a43e5d8a306ef179d914546c7015c4c9928","checks":[{"assertions":[{"actual":0,"comparison":"candidate-minus-baseline","expected":0,"metric":"/failures","operator":"lte","passed":true,"reason_codes":[],"report":"junit"},{"actual":0,"comparison":"candidate-minus-baseline","expected":0,"metric":"/errors","operator":"lte","passed":true,"reason_codes":[],"report":"junit"},{"actual":90.0,"comparison":"candidate","expected":85,"metric":"/percent_covered","operator":"gte","passed":true,"reason_codes":[],"report":"coverage"},{"actual":-0.11857707509881266,"comparison":"candidate-minus-baseline","expected":-1,"metric":"/percent_covered","operator":"gte","passed":true,"reason_codes":[],"report":"coverage"}],"id":"tests-and-coverage","mode":"differential","reason_codes":[],"severity":"blocking","status":"PASS"},{"assertions":[{"actual":0,"comparison":"candidate","expected":0,"metric":"/remaining","operator":"eq","passed":true,"reason_codes":[],"report":"consistency"}],"id":"task-consistency","mode":"candidate","reason_codes":[],"severity":"blocking","status":"PASS"},{"assertions":[],"id":"types","mode":"candidate","reason_codes":[],"severity":"advisory","status":"PASS"}],"config_sha256":"853db4b43f2001c4ed3251b6ac96478b09eb82f2d75bc7c5a22f639041c9f6c1","duration_ms":9530,"exit_code":2,"finished_at":"2026-09-03T19:01:48.088898Z","manifest_path":"manifest.json","patch_sha256":"ada0860008e824fa762a13009e6005b4946900c7771261fae2af46e6078d77a3","reason_codes":["PATH_OUTSIDE_ALLOWED","PATH_REVIEW_REQUIRED"],"run_id":"20260903T190138Z-42c8335caa65","scope":{"changed_paths":["CHANGELOG.md","README.md","setup.py","slugify/slugify.py","tox.ini"],"forbidden_paths":[],"outside_allowed_paths":["CHANGELOG.md"],"reason_codes":["PATH_OUTSIDE_ALLOWED","PATH_REVIEW_REQUIRED"],"review_required_paths":["CHANGELOG.md"],"status":"NEEDS_HUMAN"},"started_at":"2026-09-03T19:01:38.558013Z","verdict":"NEEDS_HUMAN","version":1}
