{"base_commit":"fbb0901f92b8806c5a0a9b7a70a634e7fca6e214","candidate_tree":"f4b1871ce47d6c7260a8b3c8db1c0a060ec316de","checks":[{"assertions":[{"actual":0,"comparison":"candidate-minus-baseline","expected":0,"metric":"/failures","operator":"lte","passed":true,"reason_codes":[],"report":"junit"},{"actual":0,"comparison":"candidate-minus-baseline","expected":0,"metric":"/errors","operator":"lte","passed":true,"reason_codes":[],"report":"junit"},{"actual":90.0,"comparison":"candidate","expected":85,"metric":"/percent_covered","operator":"gte","passed":true,"reason_codes":[],"report":"coverage"},{"actual":-0.11857707509881266,"comparison":"candidate-minus-baseline","expected":-1,"metric":"/percent_covered","operator":"gte","passed":true,"reason_codes":[],"report":"coverage"}],"id":"tests-and-coverage","mode":"differential","reason_codes":[],"severity":"blocking","status":"PASS"},{"assertions":[{"actual":8,"comparison":"candidate","expected":0,"metric":"/remaining","operator":"eq","passed":false,"reason_codes":["ASSERTION_FAILED"],"report":"consistency"}],"id":"task-consistency","mode":"candidate","reason_codes":["ASSERTION_FAILED"],"severity":"blocking","status":"FAIL"},{"assertions":[],"id":"types","mode":"candidate","reason_codes":[],"severity":"advisory","status":"PASS"}],"config_sha256":"853db4b43f2001c4ed3251b6ac96478b09eb82f2d75bc7c5a22f639041c9f6c1","duration_ms":11213,"exit_code":1,"finished_at":"2026-09-03T19:36:41.750454Z","manifest_path":"manifest.json","patch_sha256":"149898cf6e9fb8727677da289c534df0d86f920e08e53eb0f776e1422b93ea6b","reason_codes":["ASSERTION_FAILED"],"run_id":"20260903T193630Z-5f0ac915e44d","scope":{"changed_paths":["README.md","setup.py","slugify/slugify.py"],"forbidden_paths":[],"outside_allowed_paths":[],"reason_codes":[],"review_required_paths":[],"status":"PASS"},"started_at":"2026-09-03T19:36:30.53594Z","verdict":"FAIL","version":1}
